,review_author,review_header,review_helpful,review_posted_date,review_rating,review_text,review_length
0,tony,Sound bar,0,2018-08-12,3.0,I like this sound bar it small it has great sound,49
1,VRougeux,Weird Product,0,2018-08-12,2.0,"This product arrived quickly and packaged nicely.  My son installed it for me.  It has nice sound and I like it well enough; however, I find that every time I change the channel on my cable remote it interacts with the soundbar.  Every time I scroll through the channel guide with my cable remote the sound on the soundbar raises to unbelievable levels.  It's just weird and annoying.  I gave this product a 2 because I do like the sound, but it's just weird.  I wouldn't recommend it to anyone.",495
2,Braedon Wilson,Decent sound bar but too few features,0,2018-08-09,2.0,The sound bar is decent for the price but has very little features. The real problem with it is it has zero customization features. I wish you could control individual sounds like bass or treble but I didn’t expect much for the price I paid. Another issue I have is not being able to tell what volume I’m on. It’s frustrating trying to find the right volume. Then the inconsistency of the volume is frustrating. Sometimes I won’t be able to hear a thing and then a commercial comes on and wakes up the whole neighborhood. Only reason it gets 2 stars is for the price and the simple fact that it produces sound.,610
3,Laura Sanchez,Nice Sound for a low budget sound bar,0,2018-08-08,4.0,"Dont spect to much and you will find a good sound bar in this product, No HDMI port so you only have the optical, RCA, AUX or Bluetooth.
The bass sounds very good even though it doesnt have a woofer",198
4,Amazon Customer,Excellent soundbar!,0,2018-08-07,5.0,Amazing sound and volume levels!,32
5,Anonymous,Great sound. Not too big not too small. Just right,0,2018-08-07,5.0,Wow I’m very amazed by this sound bar. Sounds amazing. Only flaw  found is the instructions are in several languages except English. But you don’t need instructions to connect it all you need is common sense. Sounds loud enough for a small apartment. Bass sounds great. FYI have triple A batteries ready for your remote.,320
6,Eric S,Perfect for a small room!,0,2018-08-07,4.0,I am using this as a wall mounted set of speakers under my PC monitor.  The sound is way better than the LCD monitors small speakers.  Rich sound - but certainly not booming bass.  It has enhanced my experience and not cost me a fortune.  Perfect for what I needed.,265
7,13usarmy,No instructions or bass. Decent sound.,0,2018-08-07,3.0,"Not much bass, which makes it sound kind of hollow, but better than the tv speakers. No installation instructions which made install way more complicated than it needed to be. Not worth returning but wouldn’t recommend it.",222
8,Justin,"Sounds good, for the price.",0,2018-08-07,5.0,"Very easy to setup. From out of the box, to listening to the T.V. playing through it, maybe 2 minutes.
 And for the price, the sound quality really surprised me. Good tone at any level. Yes I would recommend this unit, if you're not looking to break the bank, and still have a quality sound bar.",295
9,Amazon Customer,Will try again,0,2018-08-06,1.0,At first I really liked this product but when I tried to turn down the sound with the remote turned it up to the maximum level and wouldn’t turn off. I also turned it off and I could not turn it back on.  I’m going to see if I can return it and get a replacement. I already have the screws in the wall so I would like the same one.,331
10,Deana,Just what I needed,0,2018-08-05,4.0,"Great sound bar, real good sound",32
11,shoesRme,Keep packing box,0,2018-08-03,3.0,"I have tried to hook this to two different TVs, it not working on either one.  The only reason I haven’t sent it back is to much trouble",136
12,Michael Hazard,Did not boost my TV's volume,0,2018-08-01,2.0,I purchased this based on an Amazon customer review that indicated the item had resolved a volume issue (too low on some channels) they were experiencing.  I have the same problem but this sound bar did not help my issue at all.,228
13,cbkinnc,I like it. Plenty of sound,0,2018-07-31,4.0,"I like it. Plenty of sound, lots of ways to connect, perfect width for my needs and a pretty good pice. Kinda sounds a little hollow for my tastes but otherwise, its good",170
14,Alicia,Great purchase,0,2018-07-31,5.0,Love the sound. Love the Bluetooth capabilities.,48
15,A Reader,Does NOT Support Amazon TV,1,2018-07-31,1.0,"Because I had an electrician at my house doing other things, I had him install the Tao Tronics sound bar.  Seemed to work fine, but then, days later, I switched to Amazon TV (and Acorn): nothing.  Spent some time trying to learn what I had done wrong, pushing buttons here and there, testing....  After paying an electrician to check things out, I finally wrote the company.  The company offered me a 30% refund (if the defect did not bother me much!) and finally admitted that the bar simply did not support Amazon.  No reason why given - but the fact apparently was well known before I wrote.  I was given a pre-paid return label and a refund (had to buy a box for the equipment, since had thrown away the original; know better now) and got a full refund.  Of course, I have spent about twice what the thing cost and lost several hours of my time.  Bought a Vizio 28 2.1; installed it in about 10 minutes; it works fine - on all.",931
16,DeKovin H.,I like it because it is perfect size to fit media ...,0,2018-07-30,4.0,"I like it because it is perfect size to fit media center in my bedroom. Sound is way better than TV speakers and that I can stream music from my Iphone. I wish that volume could be controlled by my Direct remote, hate having a thousand remotes. Overall I'm happy with it. Went on the site to try to register for extra warranty but got some error and it would not go through.",374
17,Amazon Customer,Dead sound bar,0,2018-07-27,1.0,"3 months after purchase, it died.",33
18,SB New Jersey,Very satisfied with unit and delivery and very easy setup,0,2018-07-26,5.0,"Very satisfied with unit and delivery and very easy setup. I had a problem hearing clearly before and now it is crystal clear.
I also noticed that a question was asked if they can still turn up volume on remote in addition and you CAN.",235
19,W. Moore,Oh question. My opinion is hardly a headline,0,2018-07-25,4.0,"Direct connected  by the optics leads to a Samsung series 8 TV.  It does seem to offer some degree of clarity to voices and some depth to music.
 I do lament  having to use the TT remote for all volume changes.",210
20,briana,Not the best.,0,2018-07-24,3.0,Ok sound for the price. Not as loud as I’d want.,48
21,atmoschem,Stylish and the sound is good!,0,2018-07-24,5.0,"After three month of use, I'm very pleased with the soundbar.
I owned few soundbars. it can easily compete with those big brand names. The sound is punchy and loud for being only 25 inch. I have a 55 TV so this soundbar looks pretty small but it's got a variety of inputs such as bluetooth, optical cable, as expected. I think the physical look of it is great too with minimal branding! it also has the side buttons just in case to lose the remote for some reason. The only thing needs to delete is the Indicator light in the middle. When watching the TV, I couldn't help but to keep looking at the blue dot...",610
22,Amazon Customer,JUST BAD,0,2018-07-23,1.0,Absolute worst sound I've ever heard! Sounds like crumpling paper together!,75
23,Michael Albright ,Great buy!,0,2018-07-23,4.0,"What a great buy, I own 2 other sound bars that are high end and I have to say this unit is right up there with them. I purchased an inexpensive projector and that’s what I’m using this sound bar with. The only thing that would be better is if it had a little more bass to it but other then that definitely worth the money and then some.",337
24,James C.,Improvement over TV speakers,0,2018-07-22,3.0,"Good sound bar for the price. Definite improvement over weak TV speakers. Currently there are no remote codes so it can't be used with universal remote (ugh one more remote to track). Noticed that Verizon Fios remote (mainly up/down arrows buttons and channel up/down buttons) repeats last input from soundbar remote. This gets annoying when scrolling/surfing channels and volume is constantly changing up/down.
8/7/2018
Update: All buttons on the FIOS cable remote repeat the last soundbar remote function.
After adjusting the volume on the soundbar, I hit the input button (Audio, OPT, BT) for the active input to prevent the cable remote from adjusting the volume. Simple workaround.",686
25,Amazon Customer,Well executed product,0,2018-07-22,5.0,"Relatively compact profile. Good dynamic range for the money. Best personal use is with television - gives reasonable depth and clarity to broadcast content.  Optical connection sound output has a slight delay behind television video output. Not a problem with bluetooth connection.  Handy for streaming audio from mobile devices, with decent quality.",351
26,Chris Matthews,Very disappointed.,0,2018-07-22,2.0,"For a novice, I didn’t know that I had to purchase an optic cord to use with my TV. Isn’t that why people buy these things? And it only works 75% of the time when I use the Amazon Firestick. Very disappointed. I will be exchanging it.
Update: This has been working only 25% of the time with the Firestick & Netflix.",315
27,Monty,Works fine and connection is easy but...,0,2018-07-21,2.0,It works fine and the hook up to Bluetooth is super easy. But I am using it to replace some cheap computer speakers and I don't think the sound is any better.,158
28,D. Williams,Works as intended.  Sound quality is not outstanding.,1,2018-07-21,3.0,"Works as expected.  The sound seems a little thin (not much bass), and it is a pain to have to use two remotes--one for the speakers and one for the TV.  The bluetooth feature works as intended.  I mounted this on top of the TV, which is mounted too high to begin with, so I have to hold the remote at head height or above to work the speakers.  A broader area of response to the remote would have made the unit. but a better position for the speakers would have been under to TV (there already was a cable box mounted below the TV)",532
29,Just a guy,Should be in a landfill  pile of Crap!,1,2018-07-21,1.0,"I was not looking for anything special from this product except for it to work. The remote was dead and would not turn the unit off or on even when pointed directly at the unit. If I have to work that hard for the thing to work, it is not worth my trouble. I have a older Samsung U8000 TV from 2009 with optical audio and the speaker would not recognize the signal. Garbage! I set the TV to external speakers. I also tried the RCA plugs and I got nothing. I cycled through the side buttons and also got nothing. Pure garbage. Save yourself the heartache and frustration and stay away from this product.",602
30,Beth,Don't waste your money,0,2018-07-21,1.0,Had it for 3 months and it barely functions now. It was great at first but now the volume will completely go out for no reason after about 30 minutes of use and the remote is junk. You get what you pay for I suppose,215
31,Thomas Ramage,Good for the price.,0,2018-07-20,4.0,This speaker works well for the price.  It brings trebble out in front of the base so you can here the taking over background noise.  I can't hear the words without it.,168
32,Clawhammer91,A nice starter,0,2018-07-20,4.0,"I was happy to see it came with everything needed except for 2 AAA batteries. My only issue is that the speaker lacks on treble. Great for voice amplification for the tv. I was able to run both the sound bar and my tv speakers at the same time so i can balance my highs, mids and lows together. It gets the job done.",316
33,colby goodman,Very limited. Very basic.,0,2018-07-19,1.0,"Junk. Limited to optical in, BT, or headphone jack. No hdmi. Unit won’t seamlessly pair with Samsung TV and no remote code for Xfinity. Unless you want an overpriced iPhone music speaker, stay away if you’re looking for a tv speaker.",233
34,Karla Painter,Muffled sound.,0,2018-07-19,2.0,I use the sound bar with my television. It has a muffled sound to it... No clarity.,83
35,Amazon Customer,"May not work with Netflix and Amazon Prime (HBO, Starz, etc.)",0,2018-07-18,3.0,"I have a Sony Bravia and it has no way to change the audio output format.  I was depending on the optical connection to the soundbar for enhanced sound quality.  I discovered too late that  Netflix and Amazon Prime Video (and I don't know what else yet) don't work for optical output, on this TV anyway.  So for much of my viewing I am forced to use the standard audio input which is really no better than the tv speakers.  A search online shows this is a common problem and may or may not be solvable for you depending on your TV.  This is NOT a soundbar problem; the soundbar is good quality and sound with optical input is very good.  Just be aware.",652
36,Amazon Customer,I like the sound quality,0,2018-07-18,3.0,"I like the sound quality. But my cable remote 'sometimes' effects the volume of the soundbar. And 'sometimes' the volume control on the device's remote gets a mind of its own, meaning down becomes up. I wish there was a way to link a universal remote to the soundbar or at least a way to completely separate the two.",316
37,Bye Bye Blackbird,"So many problems, it is really annoying.",0,2018-07-17,2.0,"Provides great sound but will randomly go static. So I have to turn everything off then turn them back on. DVD player included. If I leave a movie to play on repeat (sleeping noise and such) immediately on the second repeat, the sound is WAY off, by at least a 4 second delay. Which will not go away unless I turn everything off, DVD player included. Really annoying .",368
38,Barb F.,Five Stars,0,2018-07-16,5.0,We needed a replacement and this worked out great.,50
39,fscoglio,Good sound,0,2018-07-15,4.0,Good sound and great value. My only complaint is they could have added Bluetooth output for headphones.,103
40,Niles R.,Confidence in Specs,0,2018-07-13,1.0,"1. INSTRUCTIONS no help
2. Suppled cables from TV did not permit use
3.Remote did not work with TV
(Only work with ON OFF
functions)
4. Unit did not PAIR) with android cell phone ( Amazon basic speaker
works great)
5. Would not recommend!",238
41,Gayle LaPenna,Five Stars,0,2018-07-13,5.0,works great and sound is good for the value.easy hook up,56
42,Jon,One Star,0,2018-07-13,1.0,Didn't work.,12
43,J.D.,Great value in a small soundbar,0,2018-07-12,5.0,"Great small sound bar for the price. I purchased this sound bar for the 24inch tv in our RV. It is about 3 inches wider than the TV. The element TV sounds like a 70’s transistor radio, you could not hear it over the Air Conditioning. This bar sounds great and has surprisingly good bass for its size and price. It’s nice to be able to play pandora and XM radio as well. I am very satisfied with the purchase and would buy again.",428
44,Hank Ifer,TaoTronics living up to their reputation (actual product dimensions included),0,2018-07-10,5.0,"Great soundbar. Really fills the room with good volume. The soundbar dimensions are approximately 25"" long x 3.25"" deep x 2.7"" tall. That was the part I was most worried about. I use the optical cord and the sound is clear and loud. Would definitely recommend",259
45,J. D. S.,Works Well,0,2018-07-09,4.0,The sound isn't as good as our 20 year old Sony amp with Bose speakers but it works really well for our second TV. No complaints!,129
46,guy a,Great for the money.,0,2018-07-09,5.0,Alittle confused on set up. The direction book is useless ; called the company customer support. They were very polite and walked me through the set up. Sound's wayyyyyyyy better than the stock inset tv speaker. Sound's really amazing for video game's. Great base and mid's. Highly recomend this product... Doesn't support live Youtube audio.,342
47,Ashlie Lanning,Skip this one,0,2018-07-09,2.0,"Can’t get it to work with my new Vizio smart TV. No HDMI connection, which I should have known before I bought it, so FYI.",122
48,Amazon Customer,Sound bars are great!,0,2018-07-08,5.0,I love Love having a sound bar!! I wish my cable remote would control it but that is a small wish.,98
49,Jim Olson,Sound is not great. Can't figure out what seems to be missing ...,0,2018-07-08,5.0,"maybe even less than okay.  Sound is not great.  Can't figure out what seems to be missing but it just sounds cheap.  In fact my last sound system was cheaper and sounded better.  Won't buy this brand again for anything.
Sunvalley exchanged with another one and it sounds great without problem.  Only thing i don't like is that it turns off when tv is left alone without something playing.  Don't know why they did that but sound is great.",439
50,Dawn M Barber,Nice sound. Instructions consist of a list of components,0,2018-07-08,4.0,Nice sound for a good price. The lack of instructions on how to hook it up frustrating when you are inexperienced. It did turn out to be fairly easy.,149
51,brian lacniak,"This is an amazing speaker, it blew my mind",0,2018-07-07,5.0,"I have over 100 Amazon orders and this is my first review. This is an amazing speaker, it blew my mind. For the price I thought I would get something C+ but this speaker is A++. Highly recommend to any buyer looking for a good speaker.",235
52,Karen Smith,Five Stars,0,2018-07-07,5.0,I like this sound bar. I can hear my TV over my air conditioner and fan now.,76
53,Kindle Customer,I didn’t use the Bluetooth function but the sound is good and the remote works well,0,2018-07-04,4.0,I liked the product because it was very easy to set up and works well,69
54,Stanton D. Allaben,Waste of money,0,2018-07-04,1.0,Junk. This product comes with unintelligible directions. I had to call them to figure out how to hook it up.  I bought it to use with Prime movies....it doesn't work with that and  maybe not Netflix and Hulu too.  Waste of money.,229
55,Douglas,Camper wireless tv sound,0,2018-07-04,5.0,"Perfect for what I need it for.  I use it in our camper room to hear our tv.  We couldn’t hear TV with the AC on.  I bought a Allimity transmitter to put on my tv to get a Bluetooth connection(wireless), you just have to run a power cord.",238
56,brian Carridice,links up to my phone easily.,0,2018-07-04,5.0,clear sound. links up to my phone easily.,41
57,francis sanchez,Exceñente experiencia de sonido,0,2018-07-03,5.0,"Bu2na adquisición, tal como la queria",37
58,Darrell,Just OK,0,2018-07-03,3.0,No control,10
59,Amazon Customer,Great sound bar!,0,2018-07-03,5.0,great little sound bar for the money.  highly recommend.,56
60,road warrior 1,"Soundbar, soundbar, soundbar!  Glad I met ya!!",0,2018-07-03,5.0,"Ordered from Amazon and arrived in 2 days... worked absolutely wonderfully and enhanced our TV viewing with much better audio than before.  BUT!!  It only lasted 4 days and it quit.  Called the Company's tech support, they tried everything and when they coud not help, they referred me to Amazon to return it.  I spoke to a gentleman who was extremelly nice and helpful.  He had me return it and said the credit would be applied to my account within 3 working days.  I returned it, and went to the site again and ordered it, and the new one arrived and it is working perfectly.. wished we had ordered this several years ago when the TV was new... well worth the price and the Tech support could not be any better.  Yep, would order again, even if this one goes out... works fantastically for TV shows and when watching movies.",826
61,roger white,"sounds pretty good, and has a neat sleak appearance",0,2018-07-03,4.0,"The sound bar works very well, sounds pretty good,  and has a neat sleak appearance. However, I would have liked to have had a more extensive operation/set up manual. The few words that come with the unit have little or no useful instructions. Do not know how to set up blue tooth on it.",287
62,Christopher,One Star,0,2018-07-02,1.0,Crap. Stopped working after 30 days.,36
63,ChicagoBob,Terrible sound,1,2018-07-02,1.0,God awful sound.  Crackle and popping.  Really disappointed.,60
64,AS,Definite improvement over the TV speakers. Great for a smaller space to increase the clarity of voice on the TV.,0,2018-07-02,4.0,Definite improvement over the TV speakers. It works fine for our small living room.Probably not the clearest or loudest but it is a good price for the quality and size. Great for a smaller space to increase the clarity of voice on the TV.,238
65,Paul P,"Nice sound from a 25"" soundbar",0,2018-07-02,5.0,"This soundbar has pretty rich sound fot its size. I use it in a 12x16 bedroom and it certainly fills that space. It's attached to a 50 inch Samsung Series 6 smart TV, which I found to have less than stellar sound, so got this soundbar. Didn't  think a bigger one was necessary for the space I have. I use both Bluetooth and optical connections. Both work well, but I can use my existing remote for volume changes with the Bluetooth, so I use that most. I don't hear a lot of difference berween the two. This is absolutely an improvement over the TV speakers of course, with deeper bass and overall depth of sound that I was a bit surprised by.  I think this TaoTronic unit is just fine for me, in this sized space, so I do recommend  it for that. It is sleek looking and fits perfectly under my screen, so I barely know it's there, except for the great sound! Haven't tried it in a larger setting, so someone else will have to comment on that.",943
66,Bobalicious,Very happy with this. Easy to install and included a Toss Link cable too.,0,2018-07-02,5.0,Very happy with this. Easy to install and included a Toss Link cable too.,73
67,KPK,LOVE this soundbar!!!,0,2018-07-01,5.0,"I am very pleased with this soundbar. Installation was simple. Connecting with Bluetooth is reliable. The sound is amazing. It has the potential to be very loud. When we are not using it for tv watching, we are playing music on it. This sound bar meets all our home audio needs at a very reasonable price!",305
68,Robert Hug,to much like the Fire stick controller (not TaoTronics fault),0,2018-07-01,4.0,Works well after playing with some settings on tv.  Wish it would go a bit louder because some stations on cable seem to have lower volume then others.  Wish controller was a different shape or color...to much like the Fire stick controller (not TaoTronics fault).,264
69,Mark,Great sound!,0,2018-06-30,5.0,Great sound!  Fast delivery!,28
70,Amazon Customer,Great Sound,0,2018-06-30,4.0,The sound is awesome on my tv and my Bluetooth. Directions were not very clear. I ended up using the opt option and chord that came with it. I will be purchasing another for another room in my place. 4 stars based off of directions.,232
71,LesRad,Check your TV's audio output before you buy.,0,2018-06-26,4.0,The soundbar works well on my other tv's tho we can't connect to my vizio E371VA. Only spdif output and converter box didn't help.,130
72,Cameron Boss,Dosent work,0,2018-06-25,1.0,I bought this product and I can’t use my remote or the side buttons to change anything I can only turn it on and that’s it waste of money I’m disappointed because I was very excited,181
73,Julie Truchot,Five Stars,0,2018-06-25,5.0,It is a good sound bar very happy!,34
74,Jean Paul,Cannot get to work.,0,2018-06-24,1.0,Cannot get to work. Please contact me if possible. There was no instructions.,77
75,Paul,Not worth it,0,2018-06-24,1.0,First you do need to use their remote if you use the optical cable (really another remote guys!). If you use the 3.5 you’re not supposed to need it. All mine did was buzz annoyingly. Don’t buy this. It’s not worth it. There are better ones out there for about the same money.,275
76,kj,"The bar looks good, the sound quality is not the best but ...",0,2018-06-24,4.0,"The bar looks good, the sound quality is not the best but great for the price. I have connected this with an older TV and it sounds much better now.
The quality is good but the base is okay. Over all I recommend this product",224
