,review_author,review_header,review_helpful,review_posted_date,review_rating,review_text,review_length
195,avman,"Better than the built in TV speaker, overall good audio quality, looks nice",0,2018-03-23,5.0,"Sleek looking glossy piano black finish sound bar works well and looks great. Sound quality is decent but for about 80 dollars it's pretty good. I like the fact that I can connect via optical input, 3.5 Aux input, and Bluetooth. This is better than the TV speakers but there are others out there that sound better but at a much higher cost.",340
196,Weis,Gets the job done,0,2018-03-20,5.0,Great! Small size and sounds good. Works well,45
197,Saphira2021,A very nice sound bar!,0,2018-03-16,5.0,"A very nice sound bar!
This sound bar produces a very nice quality sound, both high and low sounds are true. It is compact, fits nicely under TV and is wall mountable, it operates by remote. Even though the instructions say remote is good at 3', in reality, it works at 10-12 feet as well. Very easy to connect to blue tooth.
It works great with my TV and it is nice that it can be connected with an optical cable. Makes it great for watching movies.
I wish for better instructions on optical and for power on/off button on the speaker.",536
