,review_author,review_header,review_helpful,review_posted_date,review_rating,review_text,review_length
77,Nick,Great value for the price point!,18,2018-06-23,5.0," Overall, very pleased with this product.  I purchased this product to enhance the sound of my TV for music, movies, shows, and video games.  Extremely satisfied so far, I have tried many other sound bars in the past and they have been underwhelming in comparison.
Packaging was solid and product was untarnished upon delivery.
Extremely fast setup, was able to pair my phone and laptop within 2 minutes of taking it out of the box to initially test the sound quality.  Trebles and mids are very crisp.  For a soundbar, the bass is present and delivers good sound.  However, I also have a few subs hooked up to my TV so I am not as concerned about this product having ground-shaking bass.  As such, if you are expecting strong stand-alone bass, I would suggest supplementing this product with one or more subwoofers depending on the size of your room.  Finally, unlike other soundbars I have used in the past, the sound does not get distorted when increasing the volume.  Pleasantly surprised at this ---- definitely a testament to the internal acoustics.
Didn't have any trouble connecting this soundbar to my phone via Bluetooth and to my TV via the included optical cable.  Being able to shift between these modes is helpful when deciding whether to keep connected to the TV or just using it on its own.  The transition between modes is very fast as well, which is convenient.
There is a full set of controls on the side of the soundbar (just in case you misplace the remote) which is definitely a plus.  The remote is lightweight, easy to use, and met my expectations.
All-in-all, I really like this soundbar!  Very good value, I will be sure keep this review up-to-date should my expectations change in either direction.",1725
78,R. Stockton,Terrific value,0,2018-06-23,4.0,"The feel and heft of this product is excellent. Very solid, very functional. For its intended purpose, it woeks well, simple bluetooth pairing and use. We have wall speakers, and it equals or surpasses those. The hard part is trting to compare to other products because this is my only one. Would the Bose small bar sound better? Three times as good, since it costs that much more? Probably not. For all the features, performance, and cost, I am thrilled with this one.",469
79,BJG,Transfer of control unintentinally to my tv remote,0,2018-06-22,4.0,"Sound is OK but my tv remote will change the volume anytime I change the station ---- not good.
Continued assistance from Tao Tronics finally solved the issue.  They stand behind their products very well.",204
80,Brian,Five Stars,0,2018-06-22,5.0,Great sound!!!! use it on my outdoor tv.  really works and is easy to install and use.  Highly recommend,104
81,Jim Lloyd,"...even the wife likes it, she normally doesn't like anything!!",1,2018-06-22,5.0,"...Tao Tronics. ...hook up the sound bar as soon as it came. Went real well, I didn't even have to swear...the wife can't believe it! I love it when I prove her wrong! Sounds great too, even the wife likes it!
  Looks like its a keeper. And it didn't break the bank either!",273
82,Nate Young,Great sound!,0,2018-06-22,4.0,The sound quality is great but it stinks that using the optical line requires a separate remote from the TV. It also stinks that the remote that comes with the soundbar didn’t even come with batteries...,203
83,William A Heaton,Great little soundbar!,0,2018-06-22,5.0,I needed a small soundbar for my new TV - this one is perfect for my needs.,75
84,Strider,Great soundbar that won't break the bank,0,2018-06-21,5.0,Very good for the price. Gets quite loud. Big improvement over TV speakers,74
85,NoThreePutts,Five Stars,0,2018-06-21,5.0,Works well & is an improvement over the tv's speakers.,54
86,Bear7170,Five Stars,0,2018-06-21,5.0,Sounds good.,12
87,"Daniel Francois, III","Inexpensive, yet makes quality sound",0,2018-06-19,5.0,"Very good sound quality for an inexpensive sound bar. Easy setup. The only thing I didn't like were the cheapo wall anchors that came with the soundbar. They don't have a lip, so if you push them into the wall too far you risk losing them. I suggest buying a pair of anchors that have a lip that will fit the screws that come with the soundbar.",344
88,Avotec Ultra,Good,0,2018-06-19,4.0,"Good for small room, not large open living room. Also bass suffers a little at high volume.",91
89,Charlie2,Five Stars,0,2018-06-18,5.0,Nice sound,10
90,zach hensley,Five Stars,0,2018-06-18,5.0,Sounds great and it is loud and if you like dubstep you will love it,68
91,David Dresser,Easy setup,0,2018-06-17,5.0,"Easy setup, great sound, works great with TV and phone",54
92,Krams,Really great sound and great looking,3,2018-06-15,5.0," UPDATE: This is still a great sound bar. the update is regarding the mounting screw/plastic anchor provided. The anchors are not that great and you will need a working anchor to mount this in a drywall.
This is a really nice sound bar. Small enough to be a large blue tooth speaker but yet will fit under a TV for a great sound either way. Nice deep bass for its size. Clear and loud. Easy connections to my phone and mac. Connects to other devices as well easily. The controls are discretely placed. Keeps little hands from messing around with the setup when placed appropriately. The added remote control allows this to be mounted so that the controls are hidden completely. It has mounting hooks on the back fro wall mounting. and comes with screws and drywall plastic anchors to get the job done - the measuring sheet in the box allows for easy drilling and mounting the screws right the first time on your wall. The speaker then can be attached to the screws simply by sliding it in. The power port is set inside at a depth so that the power plug does not cause any issues when mounted on the wall.
The only downside that I saw was the glossy surface grabs on to finger prints like crazy but again it makes it look good when it is visible and is easy enough to cleanup. Typical glossy surface problem. However when mounted that goes away.
The sound fills a very large room comfortably and no vibrations when the volume is maxed out.
Great speaker all in all. I was invited to review this product - I found the product to be great and a great value for the price.",1568
93,Amazon Customer,Great for the price,0,2018-06-15,5.0,"Pretty easy to install and connect to devices, high-quality for not being a very well-known brand. The sound is good and it gets pretty loud.",141
94,crispymnmguy,Works great. Speech comes through more clearly,0,2018-06-15,5.0,"Works great. Speech comes through more clearly. Price is reasonable. My only quibble is that the instructions could be written more clearly, but the comments by reviewers made installation easy.",194
95,JP,Top Quality Sound Bar!,0,2018-06-15,5.0,"This is an excellent sounding Soundbar with great Bass, and sounds bigger and louder than most sound bars, without distortion. It easily pairs to Bluetooth devices, remote is easy to use with separate buttons for each device. This is a top notch sound bar, great for small to medium sized roons. I'm buying another one for the garage.",334
96,JV,"Good, but didn't work with aerial broadcast",2,2018-06-13,5.0,"I bought this as I use an aerial on my basement work-out room TV and I wasn't getting a decent sound from my TV (needed the TV volume louder than the treadmill I'm using while watching TV).  Well at least for me (suburb of Chicago) this doesn't work with an aerial broadcast.  Not sure why.  It works with Netflix and other streaming, so I can watch movies and other shows through non-aerial broadcast, so I'll be keeping it.  But you should know before you buy it (the TV I'm trying to pair the sound bar with was a 42in Samsung 2017 model from Amazon).
Update: 07/17/18 - I had mentioned in my review that the soundbar did not work with non-arial broadcast.  The company contacted be, I did not have to contact them, they tried to help and assist me in fixing the problem.  Unfortunately, the soundbar does not work with my aerial broadcast, but I was so happy with my customer service and the 50% discount that they provided me with that I upgraded the rating.  The soundbar works with non-aerial broadcast and I continue to use and I would say their customer service is probably some of the most responsive I've found on Amazon.",1132
97,Yevie,Super sound!,0,2018-06-13,5.0,Great value and sound. Just what I was looking for!,51
98,Robert,"... stock pc/laptop/phone/tv speakers then yea this will be a great upgrade, but its certainly lacking in the bass ...",1,2018-06-13,3.0,"If you're used to the stock pc/laptop/phone/tv speakers then yea this will be a great upgrade, but its certainly lacking in the bass department. Its a nice speaker but I cant help but feel like i should have spent $50 extra for a model with a nice subwoofer. Although the bass is a bit weak, its still better than whatever stock speaker you were using. Also i recommend using optical cables. Everything now comes with optical out so you may as well get the most out of this little bar speaker and get a nice optical cable.",522
99,DJ Freddie/Dekadance Radio,I was able to solve the problem and I am completely satisfied with this excellent product.,2,2018-06-13,5.0,"At first I was having a problem with sound while viewing DVD discs in which the audios weren't being affected by the sound bar.
After following suggestions from Tao-Tronics regarding the above identified product, an with some help from my Tech-Savvy daughter, I was able to solve the problem and I am completely satisfied with the excellent product. I recommend this product completely.",386
100,Brian,The speaker looks good and works great.,2,2018-06-12,5.0,The speaker is awesome.,23
101,Ryder,Excellent sound for the price.,0,2018-06-12,5.0,Phenomenal Sound!  I hooked this up to my 55” Hisence TV and it made the dialogue audible and the sounds come alive.,116
102,Amazon Customer,Five Stars,0,2018-06-12,5.0,"Easy to install and the bluetooth connection worked well, and the sound is great for the price.",95
103,Luv to Shop!,I love my new soundbar,0,2018-06-10,5.0,"I love my new soundbar!  I bought this to use for my bedroom.  The sound from TV was just okay.  When watching a movie, I felt like I needed something more to make it sound like I'm inside a movie theater.  I have been searching for a soundbar for months, finally this came up on sale for under $70 bucks!  The reviews were gr8 so I decided to give it a shot.  I purchased this on 4/13 and have been enjoying it ever since!",423
104,shinichikud0,Bluetooth doesn't work on my Samsung TV,0,2018-06-10,2.0,Impressive design. Sounds ok. I got very disappointed because it doesn't connect to my samsung TV via bluetooth. Returning it,125
105,CognitiveIndi,Better than flat screen TV speakers,0,2018-06-09,3.0,"Egh... from the reviews, I really anticipated this would be a good speaker with some base.  For the price, it isn't really that good.  Aside from Bluetooth (which is why I got it, so my wife could stream music), there is only one simple AV jack in that isn't supported by my receiver.",284
106,Amazon Customer,Easy to install and use,0,2018-06-09,5.0,Easy to install and use.  Works perfect for what I wanted.  Our LG tv has terrible speakers and are not clear.  The soundbar is very clear.,139
107,Hideyuki Imagawa,Five Stars,0,2018-06-08,5.0,Great sound and reasonable price,32
108,James Thibodeau,Sounds good and works well,0,2018-06-08,4.0,Sounds good and works well. Would be better if it had an output to be able to add a subwoofer to it.,100
109,David Ellis,It worked out of the box but after that the ...,2,2018-06-07,1.0,It worked out of the box but after that the volume goes up and down when you try to search for a cable channel.,111
110,Justin E.,"Standard 'modern' inputs (3.5mm jack, Bluebooth and optical) for a decent 'small' 25"" sound bar for your 'small' TV.",1,2018-06-07,5.0,"I ended up mounting this rather light soundbar (about 3 lb) to my wall right below my mounted 32"" TV in my home gym. Fortunately, the width of the screw mount holes were wide enough to allow me to drill some screws directly to my wall studs. In terms of functionality, the Bluetooth works as expected to connect my iPod to it without issues. Otherwise, I keep the soundbar directly connected to my TV via the included optical cable provided with this package. The width of the sound bar (25 inches) works well, as the TV in my gym is also small. The sound is decent enough to not complain about (especially for the price) and includes the expected inputs such as a 3.5mm jack, which allows me to input non-Bluetooth devices. Overall, there are no complaints on this soundbar, as I'm happy this soundbar actually included the optical cable rather having to scrap for one!",870
111,Vahn Awakens The Genesis Tree,"Amazing for Older TVs, But Can't Connect To Newer Ones",1,2018-06-07,4.0,"Great sound and use, but don't get this if you've upgraded to a TV from 2017/2018. I bought this to use with my old 2013 TV, which was AMAZING for the sound differences, but I just recently bought a $600 TV and this sound bar has 0 ways of connecting to it. Now it's just a big ol' brick for Alexa to speak out of, which is nice, but wasn't the intent when I bought it for future proofing my entertainment center.",413
112,Amazon Customer,very pleased with the quality and sound out of the,0,2018-06-05,5.0,"Works really well, very pleased with the quality and sound out of the bar",73
113,felipe11,Legit sound bar,1,2018-06-05,5.0,"So I don't write many reviews, but I felt like I should for this one.At first I was hesitant with TT b/c thats how I am with brands I dont know. Then I saw TT products on Best Buy. Subsequently i found a lightning deal for a TT lamp ($10) & I have had no issues with it. I then went for this Soundbar which works great, solid deal for the price. My dog ate my remote about a month in & TT sent me a courtesy replacement.Overall i am very pleased with TT (products & service).",475
114,AP0529,Amazing Sound!,0,2018-06-05,5.0,"Not sure how I've survived without this soundbar! Not an audiophile at all, but this speaker sounds amazing, both with my television and with my music from my iPhone!",166
115,San Diego retiree,Great sound bar for the money!,1,2018-06-04,5.0,"This compact sound bar is well built, solid, and packs a great sound for its size. I was impressed with the quality of its construction and weight - a sign of high grade components. For the price, I think this unit is a great choice for most consumers. I love playing music from my iPhone as well - which makes it a versatile home speaker system. Bravo!",353
116,M. Pang,Good sound quality and volume,0,2018-06-03,4.0,Just got this soundbar - I’ve used it with Bluetooth and it’s pretty loud and sound quality is pretty good. It didn’t come with the optical cable at first but I reached out and they sent me one later.,200
117,Amazon Customer,Great sound,0,2018-06-02,5.0,I love the sound. Awesome and easy to set up,44
118,steve,Five Stars,0,2018-06-01,5.0,Thanks,6
119,Amazon Customer,One Star,0,2018-06-01,1.0,,0
120,RalphL,I am happy with,0,2018-06-01,5.0,works perfectly. I am happy with it,35
121,Robert H.,GREAT PRODUCT AND SOUND!!!!!!,7,2018-06-01,5.0,"I just received the sounder and I am very impressed! Very easy to install via bluetooth. It also comes with an audio optical cable and a RCA to mini plug in case you want to connect this way.
The sound is very good!!! I wish it had a little more bass but really not bad at all. I would highly recommend everyone who wants a very nice made and sounding sounder, for a cheap price to purchase this. If you register it online, they extended my warranty by 18 months which was awesome.",481
122,virgil johnson,Very good product. Works well,0,2018-05-31,4.0,"Very good product. Works well. Only had it a couple of days, but I am really satisfied with its performance.",108
123,Dennis V Bender,Help for Setup.,1,2018-05-30,4.0,"The unit arrived with box undamaged. After unpacking, I read the instructions once I found the small folded paper in the boxes. The instructions were given in several languages with English taking up three of the folded pages with one of them a  small diagram of the control buttons on the front of the unit. Being in my seventies, I needed a magnifying glass to make out the letters identifying the buttons. I then had to find the legend which described the letters functions. Aside from additional notes, there was nothing to explain the various cord plugs and their particular use and where they should plug into the back of the TV. It was the typical ambiguous sheet I'd seen before, and I knew I would spend many minutes deciphering the instructions. Eventually i did and felt the unit was properly plugged in. I set up the TV for Sound from other  Sources, Checked the power cord that was plugged-in. Then I turned on the unit. Nothing. Rechecked every thing . Again, nothing. So I checked Amazon for Customer Services. Yeah I could call but it had to be to a company that would charge me money for a couple of minutes conversation. B.S. What a racket. All too eager to sell products, But not to follow up with helpful explanations. Last time for this Senior Citizen to get hoodwinked into this scam or buy from Amazon again.",1331
124,Robert P. Deck,Don’t waste your your money on this cheap product,4,2018-05-30,1.0,Had to add yet another remote because the manual is the busy being multilingual it is scant and obviously a translation. Tech support refers to nonexistent parts of the very tiny print of the manual.,199
125,anthonyabby,One Star,1,2018-05-30,1.0,too quiet.,10
126,Janet Hedrick,Poor Sound Quality,2,2018-05-29,1.0,Very poor sound quality.  TV dialogue and music kept breaking up.  I believe that the soundbar speakers were defective.  Do not recommend.,138
127,Rick,Five Stars,2,2018-05-28,5.0,Bar is good for the money.,26
128,Ryan,Non-Functional,3,2018-05-28,1.0,"Does not work when you try to use it as a sound system for a TV+Game System.
Then the Bluetooth didn’t even work.
RETURNED",122
129,Greco G,"Great ""little"" speaker but sounds big!",0,2018-05-27,5.0,"Excellent Quality, sounds is surprisingly good. Good buy. Feel confident buying it, it's a good product.",104
130,lawrence jaspon,it looks great and easy to install,0,2018-05-27,3.0,"it looks great and easy to install. How ever the sound is flat no base no depth it's just louder than the cheap tv speaks . If you like sound enhanced music this is the wrong unit to buy , very average sound at best .",217
131,KazeAru,This sound bar paired wonderfully with my TV,0,2018-05-27,4.0,"This sound bar paired wonderfully with my TV, and has dramatically improved the sound quality. I was having some issues from the TV which have stopped completely with the addition of my sound bar. The remote is easy to use. An audiophile might not love this item, but I really can't detect a difference between this and higher price models. It goes louder than I need it to and sounds great. It was very easy to set up.",419
132,Lubba,"36w 2ft-long speaker with bluetooth. Sound is ok,",0,2018-05-25,4.0,"This is a good-looking, loud, two-foot long speaker with several input types, including bluetooth. That’s what i bought it for. It pushes out thirtysix watts, which is plenty indoor and for a yard party. It is not wateproof that i know of, so be carefull outdoors. The setup is easy. I plugged in the power adapter (it does not run on batteries). A red light comes on in the middle of the front of the speaker. The manual explains, very briefly, that you select bluetooth, and the light turns blue to indicate pairing mode. You will see TaoTronics on your device. Easy peasy. The sound is ok, not highly dynamic, but no glaring problems either.
Uodate: Two months later, this is my favorite bluetooth speaker! It works reliabky, and i love that 36w of power, and enough bass to satisfy.",786
133,Roberta McDonough,TV sound is controlled through sound bar remote.,0,2018-05-23,4.0,Works well. We have to remember to use the remote for the sound bar to turn up the volume though. That was confusing and at times we still forget that we can't use the regular remote.,183
134,Maximilian Rockefeller,Great small sound bar for casual use,10,2018-05-23,5.0,"What we have here is a budget friendly sound bar that would be great for use as audio soeakers for a PC, a small television, or an office.
Background: I'm an avid listener of Rap/Hip-hop, Metal, Classical, the whole spectrum of electronic music, and classic/hard rock - so my taste and audio needs stretch pretty widely from base heavy, hard driving beats to clean crisp detail clarity.
This little soundbar has enough 'umph' to listen to most music adequately so long as you don't push the volume maximum.  After receiving this I put it through the ringer of songs I know will push the envelope for audio clarity and definition, base depth, and distortion. I found about half the time much of the performance depended on the audio quality of the sound file and the other half the actual speakers.
When compared to my $500 Vizio sound bar w/separate base speakera obviously there's no comparison. So keep an open mind with your expectations.
Based on the performace and size I would aay this would work great for a office PC for listening to low to moderate volume music, or for pc games where deep base isn't a priority, as well as a small TV in a kids room or guest bedroom.
For what it cost - you'll be hard pressed to find a better value. I've used enough TaoTronics products by now that their quality meets my expectations for budget consumer electronics with a number of items lasting years at this point.
When this bar, used as intended within its limits, is a good value.",1479
135,David Petters,Great value.,1,2018-05-23,5.0,"Simple set up, compact, big improvement over tinny 32"" Samsung speakers, which was my goal. Great value.",104
136,Mackenzie Hiller,very disappointed,2,2018-05-23,2.0,"I am not very tech savvy, but after the fact I discovered that not all media will connect with this speaker, so not every movie we watch comes out with this great speaker/movie theater sound. This will not work on any netflix or amazon movies/programs and only worked for a few dvd/blu-rays. But when we watch the news (regular cable TV) it sounds amazing.",356
137,Cynthia L. Ferrin,Works perfectly and easy to install!,0,2018-05-23,5.0,Easy to install. My husband mounted it on the wall. We could hear Fear the Walking Dead perfectly!,98
138,Tyler Graff,Better than a multi-speaker system,1,2018-05-22,5.0,"We have a rather large living room, our previous 8 speaker surround sound system shot craps. This sound bar was easy to install and sounds amazing. We could hardly hear the tv speakers alone, we got spoiled with the previous system I guess. We highly recommend this sound bar, and so much easier than running multiple speakers around the room.",343
139,Amazon Customer,RCA cable didn't work,0,2018-05-21,4.0,"The sound is great with this soundbar.  I bought it for my RV hoping that the volume would rise above the volume of the furnace and A/C and it does.  My only complaint is that the soundbar didn't work with the supplied RCA cable and I had to run out and buy an auxiliary cable as my TV doesn't have a port for the optic cable.  I tried to contact Tao Tronics at 7 PM eastern time to troubleshoot and got a message that Tao Tronics was closed and that they were only open until 5 PM Pacific Time.  Doing the math, one might have thought they'd be open at 7 PM eastern time.",572
140,Chad,It serves as more volume.,0,2018-05-20,5.0,"It was cheap.. Don’t expect BOSE quality. It serves the purpose of more volume, just what I wanted. I hooked up using optical cord. Hook one end into exfinity box, and the other into the bar. Adjust bar to optical and you should be in business. Works for me. Thanks",265
141,MM,Fake reviews,3,2018-05-19,1.0,Fake reviews. Subpart product.,30
142,jenpaulhome,Really a good one!,0,2018-05-19,5.0,Really a good sound bar for the money. We love it.,50
143,scrappy,"Small size , great for bedrooms or sunroom. Nice quality",0,2018-05-19,5.0,This is really a great buy.,27
144,Braiellen,Big Sound in a Small Package!,0,2018-05-17,5.0,"I was quite surprised at the sound quality in this wonderful little bar. Great surround sound quality for the price, doesn't take up much space and easy to set up! The speaker system in our Vizio can't compare and it has good bass, filling up our den with awesome sound effects. Highly recommend!",296
145,jeri,Very easy to hook up,0,2018-05-14,4.0,Very easy to hook up. Pleased with the quality of its sound. The remote is slow to respond. Have changed batteries with no change in response. Overall I’m pleased with the product.,180
146,JohnV,Could be good.  Never know because it doesn't come with any instructions!,1,2018-05-14,2.0,"This review is not about the product but the company.  Their installation/operating manual was so minimal that there was no way for me to figure out why the unit wasn't working, with my Sony TV.  As always, everything seems simple until it doesn't work and then you are left with this great looking brick!  They include a card giving you a phone number to call prior to giving them a negative review on Amazon.  Hah! After spending 45 minutes fishing wires through my entertainment cabinet, then to power up and be faced with a series of different colored lights that respond to different buttons on a poorly labeled remote without ever hearing any sound coming from the speaker the last thing I was going to do was waste any more time and call the number.  Easier for me to pack it up and ship it back to Amazon.  Lesson here is - print a freakin' manual!",856
